{
    "$schema": "https://raw.githubusercontent.com/AuburnSounds/dplug/master/plugin-schema.json",

    "vendorName": "No Name Audio",
    "vendorUniqueID": "NoAu",
    "pluginName": "Runtime User",
    "pluginUniqueID": "NAru",
    "publicVersion": "1.0.0",
    "CFBundleIdentifierPrefix": "com.nonameaudio",
    "hasGUI": false,
    "isSynth": false,
    "receivesMIDI": false,
    "category": "effectOther"
}