{
    "$schema": "https://raw.githubusercontent.com/AuburnSounds/dplug/master/plugin-schema.json",

    "vendorName": "No Name Audio",
    "vendorUniqueID": "NoAu",
    "pluginName": "Sample Meter",
    "pluginUniqueID": "SpÂ°",
    "publicVersion": "1.0.0",
    "CFBundleIdentifierPrefix": "om.nonameaudio",
    "hasGUI": false,
    "isSynth": false,
    "receivesMIDI": false,
    "category": "effectAnalysisAndMetering"
}
